{
  "id": "project_summary",
  "name": "Project Summary",
  "version": "v1",
  "model": "zai-org/GLM-4.7",
  "system_prompt": "你是一名资深软件架构师，擅长从多分支的演进摘要中提炼项目整体设计思路、关键时间节点与工程实践，并将其转化为可沉淀的开发 skill。你输出必须严谨、结构化、不要编造未出现的信息。",
  "variables": [
    { "name": "project_name", "type": "string", "required": true, "description": "项目名" },
    { "name": "branch_one_liners", "type": "string", "required": true, "description": "各分支一句话概括列表文本" }
  ],
  "user_template": "你将基于项目各分支的一句话概括，生成全项目的设计总结与可蒸馏 skill。\\n\\n上下文：\\n- 项目：{{project_name}}\\n\\n要求：\\n1) 只输出【严格 JSON】，不要 Markdown、不要代码块围栏。\\n2) one_liner 为 20~40 字中文：用一句话概括项目整体演进主题/设计主线。\\n3) detail_md 为可直接写入 Markdown 的正文，至少包含：\\n   - 整体设计思路：核心模块、边界、关键抽象（从分支信息总结）\\n   - 关键时间节点/里程碑：按时间/阶段叙述（若无法从输入推断，写“信息不足”）\\n   - 工程实践：测试、CI、代码组织、发布方式等（若无法推断，写“信息不足”）\\n   - 可沉淀 skill：可复用的工作流/决策模板/检查清单（要具体、可操作）\\n4) 不要猜测外部事实；无法确定请标注“不确定/信息不足”。\\n\\n输出 JSON 字段：\\n- one_liner: string (必填)\\n- detail_md: string (必填)\\n- key_points: string[] (可选，5~12 条)\\n\\n分支概括列表：\\n\\n{{branch_one_liners}}",
  "output_schema": {
    "type": "object",
    "required": ["one_liner", "detail_md"],
    "properties": {
      "one_liner": { "type": "string", "minLength": 6, "maxLength": 120 },
      "detail_md": { "type": "string", "minLength": 80 },
      "key_points": { "type": "array", "items": { "type": "string" }, "minItems": 0 }
    },
    "additionalProperties": true
  },
  "notes": "summaryAgent 使用。输出 detail_md 直接写入 summary.md。"
}

